{
  "schemaVersion": 1,
  "updated": "2026-10-12",
  "note": "Source of truth for GreetHub art styles. Edit this file, then run node docs/design/tools/build-knowledge.mjs. Style strings never name artists, studios or franchises; ipSafeAliases are customer phrases only and never reach a prompt.",
  "ageBandDefs": {
    "0-3": "Babies and toddlers: board-book simplicity",
    "4-7": "Picture-book years",
    "8-10": "Older kids and grown-up gifts"
  },
  "sources": [
    {
      "id": "R01",
      "title": "Publishers Weekly: 2025 children's bestsellers",
      "url": "https://www.publishersweekly.com/pw/by-topic/childrens/childrens-industry-news/article/99672-2025-children-s-bestsellers-buzzy-series-additions-graphic-novel-retellings-and-beloved-picture-books.html",
      "dateRead": "2026-10-11",
      "tag": "V"
    },
    {
      "id": "R02",
      "title": "Publishers Weekly: Caldecott win Q&A (2026-01-27)",
      "url": "https://www.publishersweekly.com/pw/by-topic/childrens/childrens-authors/article/99557-c-tia-chien-s-caldecott-win-wait-is-this-what-i-think-it-means.html",
      "dateRead": "2026-10-11",
      "tag": "V"
    },
    {
      "id": "R03",
      "title": "American Libraries: 2026 Youth Media Award winners",
      "url": "https://americanlibrariesmagazine.org/blogs/the-scoop/2026-youth-media-award-winners/",
      "dateRead": "2026-10-11",
      "tag": "V"
    },
    {
      "id": "R04",
      "title": "The Bright Agency: Trends in Children's Literature 2026",
      "url": "https://thebrightagency.com/uk/case-studies/trends-in-children-s-literature-2026-vicki-willden-lebrecht",
      "dateRead": "2026-10-11",
      "tag": "V"
    },
    {
      "id": "R05",
      "title": "Lumonova Studio: Children's book illustration styles (2025-12-20, vendor blog)",
      "url": "https://lumonovastudio.com/childrens-book-illustration-styles/",
      "dateRead": "2026-10-11",
      "tag": "V"
    },
    {
      "id": "R06",
      "title": "Printed.com: Top greeting card trends for 2026 (2026-01-09, printer blog)",
      "url": "https://www.printed.com/blog/greeting-card-trends-2026/",
      "dateRead": "2026-10-11",
      "tag": "V"
    },
    {
      "id": "R07",
      "title": "Greetopia: Greeting card design trends 2026 (2025-12-18, retailer blog)",
      "url": "https://greetopia.com/blog/greeting-card-design-trends-whats-hot-for-2026",
      "dateRead": "2026-10-11",
      "tag": "V"
    },
    {
      "id": "R08",
      "title": "Shutterfly: Top Christmas and holiday card trends (updated 2026-08-07)",
      "url": "https://www.shutterfly.com/ideas/top-christmas-holiday-card-trends/",
      "dateRead": "2026-10-11",
      "tag": "V"
    },
    {
      "id": "R09",
      "title": "ToonyStory: art styles menu (competitor)",
      "url": "https://toonystory.com/styles",
      "dateRead": "2026-10-11",
      "tag": "V"
    },
    {
      "id": "R10",
      "title": "Magic Story home page (competitor)",
      "url": "https://www.magicstory.com/",
      "dateRead": "2026-10-11",
      "tag": "V"
    },
    {
      "id": "R12",
      "title": "AI illustration tools (IllustratorMagic, Musely, Neolemon, Booklet AI): style menus via search",
      "url": "https://musely.ai/tools/children-book-generator",
      "dateRead": "2026-10-11",
      "tag": "S"
    },
    {
      "id": "R13",
      "title": "Moonpig US: hottest birthday cards 2026 (search result, retailer self-promo)",
      "url": "https://www.moonpig.com/us/blog/gifts-and-wishes/hottest-birthday-cards-usa-2026/",
      "dateRead": "2026-10-11",
      "tag": "S"
    },
    {
      "id": "R14",
      "title": "Etsy, Amazon and Hallmark listing roundups (search results, listing counts not sales)",
      "url": "https://www.etsy.com/market/watercolor_birthday_cards",
      "dateRead": "2026-10-11",
      "tag": "S"
    },
    {
      "id": "R15",
      "title": "Adobe Express design trends 2026 and Creative Market trends (search)",
      "url": "https://www.adobe.com/express/learn/blog/design-trends-2026",
      "dateRead": "2026-10-11",
      "tag": "S"
    },
    {
      "id": "R16",
      "title": "Pinterest Predicts 2026 coverage (Axios, PG Buzz)",
      "url": "https://axios.com/2025/12/09/2026-pinterest-trend-report",
      "dateRead": "2026-10-11",
      "tag": "S"
    },
    {
      "id": "R17",
      "title": "Premium stationery: letterpress and gold foil cards (Sugar Paper, museum stores)",
      "url": "https://www.belleandblush.com/collections/gold/products/sugar-paper-throw-some-sprinkles-on-it-card",
      "dateRead": "2026-10-11",
      "tag": "S"
    },
    {
      "id": "R18",
      "title": "GreetHub market landscape: Wonderbly, Hooray Heroes, Imagitime",
      "url": "docs/market/00-landscape.md",
      "dateRead": "2026-10-11",
      "tag": "V"
    },
    {
      "id": "R19",
      "title": "Design head's own knowledge of how top-selling picture books look (unverified)",
      "url": "docs/design/00-research-notes.md",
      "dateRead": "2026-10-11",
      "tag": "U"
    },
    {
      "id": "R20",
      "title": "NC State study of parents and AI picture books (2025-11-12)",
      "url": "https://news.ncsu.edu/?p=1531242",
      "dateRead": "2026-10-11",
      "tag": "V"
    }
  ],
  "categories": [
    {
      "id": "soft-watery",
      "name": "Soft & Watery",
      "blurb": "Gentle washes of color. Think baby showers, grandma and bedtime.",
      "order": 1
    },
    {
      "id": "cozy-storybook",
      "name": "Cozy Storybook",
      "blurb": "Warm, lamplit, classic picture-book charm.",
      "order": 2
    },
    {
      "id": "bold-silly",
      "name": "Bold & Silly",
      "blurb": "Big shapes and bright color, built to get a laugh.",
      "order": 3
    },
    {
      "id": "handmade-crafty",
      "name": "Cut, Stitched & Handmade",
      "blurb": "Looks you could almost touch: paper, felt and clay.",
      "order": 4
    },
    {
      "id": "retro-graphic",
      "name": "Retro & Graphic",
      "blurb": "Bold shapes and old-school printing.",
      "order": 5
    },
    {
      "id": "sketchy-homemade",
      "name": "Sketchy & Homemade",
      "blurb": "Crayon, pencil and wobbly pen. Happily imperfect.",
      "order": 6
    },
    {
      "id": "movie-bright",
      "name": "Big-Screen Bright",
      "blurb": "Glowy, rounded, animated-film looks.",
      "order": 7
    },
    {
      "id": "lifelike",
      "name": "Lifelike & Cinematic",
      "blurb": "Painted or photographic realism for grown-up moments.",
      "order": 8
    },
    {
      "id": "clean-simple",
      "name": "Clean & Simple",
      "blurb": "Fine lines, open space and hand lettering.",
      "order": 9
    },
    {
      "id": "fancy-foil",
      "name": "Fancy & Fabulous",
      "blurb": "Gold, geometry and show-off pattern.",
      "order": 10
    }
  ],
  "styles": [
    {
      "id": "watercolor_wash",
      "name": "Soft Watercolor",
      "category": "soft-watery",
      "status": "stable",
      "legacyIds": [
        "watercolor",
        "soft_watercolor"
      ],
      "products": [
        "book",
        "card"
      ],
      "ageBands": [
        "0-3",
        "4-7"
      ],
      "occasions": [
        "birthday",
        "new_baby",
        "mothers_day",
        "get_well",
        "thank_you",
        "just_because",
        "bedtime",
        "sympathy"
      ],
      "tones": [
        "tender",
        "adventurous"
      ],
      "description": "Gentle, wet-on-paper color with soft edges and a little white showing through, like a classic picture book.",
      "whyThisOne": "Warm and gentle, the safe choice when the feeling matters more than the joke.",
      "popularity": {
        "rating": "high",
        "sources": [
          "R05",
          "R07",
          "R09",
          "R12",
          "R14"
        ],
        "summary": "Named as the nostalgic default for ages 3-6, still popular for Mother's Day, strong on Etsy, and on every AI-book style menu we found."
      },
      "look": {
        "medium": "Transparent watercolor with touches of gouache on cold-press paper",
        "technique": "Wet-on-wet washes, a few dry-brush edges, paper white left as highlight",
        "line": "Thin, soft pencil-and-ink outlines that fade in places",
        "palette": "Muted warm: peach, cream, sage, dusty blue, a single deeper accent",
        "composition": "Centered subject, generous calm background, color carried softly to every edge (no white vignette)",
        "mood": "Tender, calm, nostalgic",
        "era": "Classic 20th-century picture book, refreshed"
      },
      "styleString": "Soft 2D watercolor and gouache illustration, classic children's picture book style, gentle hand-drawn ink outlines, warm natural light, visible cold-press paper grain, rounded friendly shapes, muted warm palette with peach, cream and sage, soft diffuse lighting, simple softly washed backgrounds, characters with soft round proportions and oversized expressive eyes - not photorealistic, no realistic skin texture, no sharp photographic shadows, no 3D render.",
      "avoid": [
        "photorealism",
        "3D render",
        "hard black outlines",
        "neon colors",
        "text or letters in the picture",
        "glossy airbrushed skin"
      ],
      "swatches": [
        {
          "hex": "#F6C9C0",
          "name": "blush peach"
        },
        {
          "hex": "#FBF6EE",
          "name": "paper cream"
        },
        {
          "hex": "#B7C9A8",
          "name": "sage"
        },
        {
          "hex": "#9DB4C8",
          "name": "dusty blue"
        },
        {
          "hex": "#C8441F",
          "name": "deep persimmon accent"
        }
      ],
      "consistency": {
        "bookRating": 3,
        "cardRating": 5,
        "notes": "Models hold hair color and outfit colors well but drift on face shape, because loose washes invite re-interpretation each page.",
        "tips": [